data,label_clusters
ยกเลิกและปฏิรูปกฎหมาย กระบวนการยุติธรรม ระบบงบประมาณและภาษีอากรให้เกิดความเป็นธรรม,11
ยกเลิกวีซ่า (visa) ให้กับนักท่องเที่ยวจีน,11
สร้างถนนอาหาร (Street Road),11
สวัสดิการประชาชนเกิดจากการใช้จ่าย มีรายได้คืน,11
ห้ามใช้วัสดุที่ย่อยสลายได้ยาก,11
ให้ลูกหลานเกษตรกรเรียนฟรีถึงปริญญาตรี (หากทำงานเกษตรหลักเรียนจบ),11
แก้ปัญหายาเสพติด,12
ปฏิวัติระบบการป้องกันและปราบปรามการทุจริตตามมาตรฐานสากล เพื่อลงโทษคนทุจริตโดยเร่งด่วน,12
ปราบปรามทุจริตคอรัปชั่น ปราบยาเสพติดทุกประเภท,12
ป้องกันและปราบปรามการทุจริตคอรัปชั่น,12
พลังแผ่นดินปลอดยาเสพติด,12
สร้างศูนย์บำบัดยาเสพติดมีคุณภาพ ทุกจังหวัด,12
สร้างลีกกีฬาอาชีพให้เกิดขึ้นสำหรับกีฬาทุกประเภทและพัฒนาสู่ Academy,12
หยุดปัญหายาเสพติด ขจัดผู้มีอิทธิพลให้สิ้นซาก,12
